tweet_id,timestamp_x,source,text,retweeted_status_timestamp,rating_numerator,name,timestamp_y,favourites_count,retweets_count,dog_type,breed,CI
689877686181715968,2016-01-20 18:30:32 +0000,Twitter for iPhone,This is Durg. He's trying to conquer his fear of trampolines. 9/10 it's not working https://t.co/5iH08ltkoe,,9,Durg,Wed Jan 20 18:30:32 +0000 2016,2796,1044,,Old English sheepdog,0.26915500000000003
689835978131935233,2016-01-20 15:44:48 +0000,Twitter for iPhone,Meet Fynn &amp; Taco. Fynn is an all-powerful leaf lord and Taco is in the wrong place at the wrong time. 11/10 &amp; 10/10 https://t.co/MuqHPvtL8c,,11,Fynn,Wed Jan 20 15:44:48 +0000 2016,2017,688,,collie,0.600186
689661964914655233,2016-01-20 04:13:20 +0000,Twitter for iPhone,Meet Luca. He's a Butternut Scooperfloof. Glorious tongue. 12/10 would pet really well https://t.co/VcxZQPNZaV,,12,Luca,Wed Jan 20 04:13:20 +0000 2016,2993,851,,Italian greyhound,0.322818
689517482558820352,2016-01-19 18:39:13 +0000,Twitter for iPhone,This is Carl. He just wants to make sure you're having a good day. 12/10 just a swell pup https://t.co/Wk3XCnmDvm,,12,Carl,Tue Jan 19 18:39:13 +0000 2016,3124,1297,,Pembroke,0.799319
689283819090870273,2016-01-19 03:10:43 +0000,Twitter for iPhone,Say hello to Chipson. He's aerodynamic af. No eyes (devastating). 9/10 would make sure he didn't bump into stuff https://t.co/V62rIva61J,,9,Chipson,Tue Jan 19 03:10:43 +0000 2016,3019,1004,,Scotch terrier,0.267979
689280876073582592,2016-01-19 02:59:01 +0000,Twitter for iPhone,This is Herald. He wants you to know he could steal your girl at any moment. 10/10 https://t.co/JR7hLnlgeS,,10,Herald,Tue Jan 19 02:59:01 +0000 2016,1824,639,,Chihuahua,0.6375460000000001
689275259254616065,2016-01-19 02:36:42 +0000,Twitter for iPhone,Meet Lucky. He was showing his friends an extreme pogo stick trick when he completely lost control. 10/10 still rad https://t.co/K55XrIoePl,,10,Lucky,Tue Jan 19 02:36:42 +0000 2016,1052,225,,American Staffordshire terrier,0.215161
689143371370250240,2016-01-18 17:52:38 +0000,Twitter for iPhone,Meet Trip. He likes wearing costumes that aren't consistent with the season to screw with people 10/10 tricky pupper https://t.co/40w7TI5Axv,,10,Trip,Mon Jan 18 17:52:38 +0000 2016,1865,454,pupper,English springer,0.303781
688789766343622656,2016-01-17 18:27:32 +0000,Twitter for iPhone,Meet Pubert. He's a Kerplunk Rumplestilt. Cannot comprehend flower. Flawless tongue. 8/10 would pat head approvingly https://t.co/2TWxg0rgyG,,8,Pubert,Sun Jan 17 18:27:32 +0000 2016,2052,604,,American Staffordshire terrier,0.5996600000000001
688547210804498433,2016-01-17 02:23:42 +0000,Twitter for iPhone,This is FrÃ¶nq. He got caught stealing a waffle. Damn it FrÃ¶nq. 9/10 https://t.co/7ycWCUrjmZ,,9,FrÃ¶nq,Sun Jan 17 02:23:42 +0000 2016,2398,627,,papillon,0.531279
688064179421470721,2016-01-15 18:24:18 +0000,Twitter for iPhone,This is Kilo. He's a Pouncing Brioche. Really likes snow. 11/10 https://t.co/GS76SfkraY,,11,Kilo,Fri Jan 15 18:24:18 +0000 2016,1595,323,,Eskimo dog,0.240602
687826841265172480,2016-01-15 02:41:12 +0000,Twitter for iPhone,This is Louis. He's a rollercoaster of emotions. Incalculably fluffy. 12/10 would pet firmly https://t.co/17RGvOZO9P,,12,Louis,Fri Jan 15 02:41:12 +0000 2016,2517,1009,,Pomeranian,0.99721
687807801670897665,2016-01-15 01:25:33 +0000,Twitter for iPhone,Meet Trooper &amp; Maya. Trooper protects Maya from bad things like dognappers and Comcast. So touching. 11/10 for both https://t.co/c98k1IoZKy,,11,Trooper,Fri Jan 15 01:25:33 +0000 2016,2199,658,,Staffordshire bullterrier,0.151113
687704180304273409,2016-01-14 18:33:48 +0000,Twitter for iPhone,Say hello to Blakely. He thinks that's a hat. Silly pupper. That's a nanner. 9/10 https://t.co/UwOV1jqKRt,,9,Blakely,Thu Jan 14 18:33:48 +0000 2016,2241,765,pupper,miniature pinscher,0.956063
687664829264453632,2016-01-14 15:57:26 +0000,Twitter for iPhone,Meet Opal. He's a Belgian Dijon Poofster. Upset because his hood makes him look like blond Justin Timberlake. 11/10 https://t.co/IAt3jRZ5ez,,11,Opal,Thu Jan 14 15:57:26 +0000 2016,1804,470,,pug,0.957365
687494652870668288,2016-01-14 04:41:12 +0000,Twitter for iPhone,This is Marq. He stole this car. 7/10 wtf Marq? https://t.co/MHScqo5l8c,,7,Marq,Thu Jan 14 04:41:12 +0000 2016,1757,527,,Rottweiler,0.391471
687460506001633280,2016-01-14 02:25:31 +0000,Twitter for iPhone,This is Kramer. He's a Picasso Tortellini. Tie couldn't be more accurate. Confident af. Runs his own business. 10/10 https://t.co/jIcVW0xxmH,,10,Kramer,Thu Jan 14 02:25:31 +0000 2016,1907,491,,Boston bull,0.223366
687317306314240000,2016-01-13 16:56:30 +0000,Twitter for iPhone,This is Tyrone. He's a leaf wizard. Self-motivated. No eyes (tragic). Inspirational af. 11/10 enthusiasm is tangible https://t.co/pRp1Npucbz,,11,Tyrone,Wed Jan 13 16:56:30 +0000 2016,18636,8338,,Shih-Tzu,0.747208
687127927494963200,2016-01-13 04:23:58 +0000,Twitter for iPhone,Meet Gordon. He's an asshole. 9/10 would still pet https://t.co/a34N7QwKbb,,9,Gordon,Wed Jan 13 04:23:58 +0000 2016,4969,2050,,pug,0.178205
687109925361856513,2016-01-13 03:12:26 +0000,Twitter for iPhone,This is Baxter. He looks like a fun dog. Prefers action shots. 11/10 the last one is impeccable https://t.co/LHcH1yhhIb,,11,Baxter,Wed Jan 13 03:12:26 +0000 2016,5356,2228,,borzoi,0.883086
686683045143953408,2016-01-11 22:56:10 +0000,Twitter for iPhone,This is Mona. She's a Yarborough Splishnsplash. Lost body during Nam. 11/10 revolutionary pupper https://t.co/pgD6h0yhgz,,11,Mona,Mon Jan 11 22:56:10 +0000 2016,2608,731,pupper,Norwich terrier,0.100499
686618349602762752,2016-01-11 18:39:05 +0000,Twitter for iPhone,This is Olivia. She just saw an adult wearing crocs. 11/10 poor pupper. No one should witness such a thing https://t.co/yJVTi1DjJc,,11,Olivia,Mon Jan 11 18:39:05 +0000 2016,3410,1239,pupper,Rottweiler,0.441331
686606069955735556,2016-01-11 17:50:18 +0000,Twitter for iPhone,"Meet Horace. He was practicing his levitation, minding his own business when a rogue tennis ball spooked him. 10/10 https://t.co/tB9xYjMyZd",,10,Horace,Mon Jan 11 17:50:18 +0000 2016,1751,490,,Labrador retriever,0.320012
686386521809772549,2016-01-11 03:17:53 +0000,Twitter for iPhone,Say hello to Crimson. He's a Speckled Winnebago. Main passions are air hockey &amp; parkour. 11/10 would pet thoroughly https://t.co/J5aI7SjzDc,,11,Crimson,Mon Jan 11 03:17:53 +0000 2016,3007,791,,Yorkshire terrier,0.477704
686377065986265092,2016-01-11 02:40:19 +0000,Twitter for iPhone,Meet Birf. He thinks he's gone blind. 10/10 very frightened pupper https://t.co/oDkspjNWYX,,10,Birf,Mon Jan 11 02:40:19 +0000 2016,2046,514,pupper,German shepherd,0.830816
686050296934563840,2016-01-10 05:01:51 +0000,Twitter for iPhone,This is FlÃ¡vio. He's a Macedonian Poppycock. 97% floof. Jubilant af. 11/10 personally I'd pet the hell out of https://t.co/BUyX7isHRg,,11,FlÃ¡vio,Sun Jan 10 05:01:51 +0000 2016,2067,665,,Pomeranian,0.985789
685973236358713344,2016-01-09 23:55:38 +0000,Twitter for iPhone,This is Lorelei. She's contemplating her existence and the eventual heat death of the universe. 11/10 very majestic https://t.co/xbUoULOIS8,,11,Lorelei,Sat Jan 09 23:55:38 +0000 2016,1935,477,,Siberian husky,0.450678
685906723014619143,2016-01-09 19:31:20 +0000,Twitter for iPhone,This is Olive. He's stuck in a sleeve. 9/10 damn it Olive https://t.co/NnLjg6BgyF,,9,Olive,Sat Jan 09 19:31:20 +0000 2016,6893,2587,,Yorkshire terrier,0.414963
685321586178670592,2016-01-08 04:46:13 +0000,Twitter for iPhone,This is Rocky. He sleeps like a psychopath. 10/10 quality tongue slip https://t.co/MbgG95mUdu,,10,Rocky,Fri Jan 08 04:46:13 +0000 2016,2439,579,,Boston bull,0.972483
685307451701334016,2016-01-08 03:50:03 +0000,Twitter for iPhone,Say hello to Petrick. He's an Altostratus Floofer. Just had a run in with a trash bag. Groovy checkered floor. 11/10 https://t.co/rwW7z1JAOF,,11,Petrick,Fri Jan 08 03:50:03 +0000 2016,1923,396,,Pomeranian,0.963176
685268753634967552,2016-01-08 01:16:17 +0000,Twitter for iPhone,This is Hubertson. He's a Carmel Haberdashery. Enjoys long summer days on his boat. Very peaceful pupper. 10/10 https://t.co/vzCl35fKlZ,,10,Hubertson,Fri Jan 08 01:16:17 +0000 2016,2836,1072,pupper,pug,0.999044
685169283572338688,2016-01-07 18:41:01 +0000,Twitter for iPhone,Meet Gerbald. He just found out he's adopted. Poor pupper. Snazzy tongue tho. 11/10 would hold close in time of need https://t.co/UfGkB9Wrud,,11,Gerbald,Thu Jan 07 18:41:01 +0000 2016,3779,1276,pupper,Bernese mountain dog,0.975096
684940049151070208,2016-01-07 03:30:07 +0000,Twitter for iPhone,This is Oreo. She's a photographer and a model. Living a double pupple life. 12/10 such talent much cute would pet https://t.co/zNeLxJeAoL,,12,Oreo,Thu Jan 07 03:30:07 +0000 2016,2963,944,,Border collie,0.665578
684800227459624960,2016-01-06 18:14:31 +0000,Twitter for iPhone,Meet Theodore. He's dapper as hell. Probably owns horses. Uses 'summer' as a verb. Often quotes philosophers. 11/10 https://t.co/J3Ld4fRbSy,,11,Theodore,Wed Jan 06 18:14:31 +0000 2016,2512,903,,miniature schnauzer,0.294457
684460069371654144,2016-01-05 19:42:51 +0000,Twitter for iPhone,This is Jeph. He's a Western Sagittarius Dookmarriot. Frightened by leaf. Caught him off guard. 10/10 calm down Jeph https://t.co/bicyOV6lju,,10,Jeph,Tue Jan 05 19:42:51 +0000 2016,1813,503,,Labrador retriever,0.673691
684195085588783105,2016-01-05 02:09:54 +0000,Twitter for iPhone,This is Tino. He really likes corndogs. 9/10 https://t.co/cUxGtnBfc2,,9,Tino,Tue Jan 05 02:09:54 +0000 2016,1761,456,,Chihuahua,0.379365
684177701129875456,2016-01-05 01:00:50 +0000,Twitter for iPhone,This is Kulet. She's very proud of the flower she picked. Loves it dearly. 10/10 now I want a flower https://t.co/myUUwqJIs7,,10,Kulet,Tue Jan 05 01:00:50 +0000 2016,1865,592,,chow,0.334783
684097758874210310,2016-01-04 19:43:10 +0000,Twitter for iPhone,Say hello to Lupe. This is how she sleeps. 10/10 impressive really https://t.co/Fz6iZWlk8C,,10,Lupe,Mon Jan 04 19:43:10 +0000 2016,3787,1298,,Labrador retriever,0.6278560000000001
683857920510050305,2016-01-04 03:50:08 +0000,Twitter for iPhone,Meet Sadie. She fell asleep on the beach and her friends buried her. 10/10 can't trust fellow puppers these days https://t.co/LoKVvc1xAW,,10,Sadie,Mon Jan 04 03:50:08 +0000 2016,3513,1020,pupper,bluetick,0.174738
683773439333797890,2016-01-03 22:14:26 +0000,Twitter for iPhone,This is Buddy. He's gaining strength. Currently an F4 tornado with wind speeds up to 260mph. Very devastating. 9/10 https://t.co/qipZbshNsR,,9,Buddy,Sun Jan 03 22:14:26 +0000 2016,3070,1218,,miniature pinscher,0.0728852
683742671509258241,2016-01-03 20:12:10 +0000,Twitter for iPhone,Meet Sebastian. He's a womanizer. Romantic af. Always covered in flower petals. Also a poet. 11/10 dreamy as hell https://t.co/eoL1bCpWCg,,11,Sebastian,Sun Jan 03 20:12:10 +0000 2016,5972,2997,,Pembroke,0.895279
683498322573824003,2016-01-03 04:01:13 +0000,Twitter for iPhone,This is Griffin. He's desperate for both a physical and emotion connection. 11/10 I'd hug the hell out of Griffin https://t.co/ObWcOEekt0,,11,Griffin,Sun Jan 03 04:01:13 +0000 2016,2933,872,,Airedale,0.945362
683481228088049664,2016-01-03 02:53:17 +0000,Twitter for iPhone,Meet Banjo. He's a Peppercorn Shoop Da Whoop. Nails look lethal. Skeptical of luminescent orb 11/10 stay woke pupper https://t.co/H7NZFumpKq,,11,Banjo,Sun Jan 03 02:53:17 +0000 2016,2446,902,pupper,keeshond,0.508951
683391852557561860,2016-01-02 20:58:09 +0000,Twitter for iPhone,"Say hello to Jack (pronounced ""Kevin""). He's a Virgo Episcopalian. Can summon rainbows. 11/10 magical as hell https://t.co/YHXrdUTHd6",,11,Jack,Sat Jan 02 20:58:09 +0000 2016,7042,2176,,French bulldog,0.992833
683142553609318400,2016-01-02 04:27:31 +0000,Twitter for iPhone,Meet Brandy. She's a member of the Bloods. Menacing criminal pupper. Soft spot for flowers tho. 9/10 pet w caution https://t.co/hhIA3coiAJ,,9,Brandy,Sat Jan 02 04:27:31 +0000 2016,2641,934,pupper,Leonberg,0.605851
683111407806746624,2016-01-02 02:23:45 +0000,Twitter for iPhone,This is Larry. He thought the New Year's parties were tonight. 10/10 poor pupper. Maybe next year https://t.co/h3X0jK8MVM,,10,Larry,Sat Jan 02 02:23:45 +0000 2016,3143,816,pupper,cocker spaniel,0.901392
683030066213818368,2016-01-01 21:00:32 +0000,Twitter for iPhone,This is Lulu. She's contemplating all her unreached 2015 goals and daydreaming of a more efficient tomorrow. 10/10 https://t.co/h3ScYuz77J,,10,Lulu,Fri Jan 01 21:00:32 +0000 2016,1998,668,,boxer,0.722218
682750546109968385,2016-01-01 02:29:49 +0000,Twitter for iPhone,Meet Taco. He's a speckled Garnier Fructis. Loves to shadow box. Ears out of control. Friend clearly impressed 9/10 https://t.co/85X1GHohFr,,9,Taco,Fri Jan 01 02:29:49 +0000 2016,1401,398,,English setter,0.947198
682662431982772225,2015-12-31 20:39:41 +0000,Twitter for iPhone,Meet Joey and Izzy. Joey only has one ear that works and Izzy wants 2015 to be over already. Both great pups. 11/10s https://t.co/WgQTIQ93BB,,11,Joey,Thu Dec 31 20:39:41 +0000 2015,2811,987,,beagle,0.413824
682389078323662849,2015-12-31 02:33:29 +0000,Twitter for iPhone,"Meet Brody. He's a Downton Abbey Falsetto. Addicted to grating cheese. He says he can stop but we know he can't
9/10 https://t.co/vBeiQq6SaZ",,9,Brody,Thu Dec 31 02:33:29 +0000 2015,1537,423,,curly-coated retriever,0.482288
682259524040966145,2015-12-30 17:58:40 +0000,Twitter for iPhone,Meet Jax. He's an Iglesias Hufflepoof. Quite the jokester. Takes it too far sometimes. Can be very hurtful. 9/10 https://t.co/i5TeG0KYcW,,9,Jax,Wed Dec 30 17:58:40 +0000 2015,3807,1078,,Siberian husky,0.43967
682032003584274432,2015-12-30 02:54:35 +0000,Twitter for iPhone,This is Ulysses. He likes holding hands and his eyes are magic. 11/10 https://t.co/gPmJHmtgak,,11,Ulysses,Wed Dec 30 02:54:35 +0000 2015,6047,1791,,schipperke,0.997953
681981167097122816,2015-12-29 23:32:35 +0000,Twitter for iPhone,This is Jimothy. He's a Trinidad Poliwhirl. Father was a velociraptor. Exceptionally unamused. 12/10 would adopt https://t.co/VwdIk0OwVx,,12,Jimothy,Tue Dec 29 23:32:35 +0000 2015,2595,920,,Labrador retriever,0.4525770000000001
681654059175129088,2015-12-29 01:52:46 +0000,Twitter for iPhone,This is Toffee. He's a happy pupper. Appears dangerously fluffy. Extraordinarily spherical. 12/10 would pet firmly https://t.co/oEXEKt3MHu,,12,Toffee,Tue Dec 29 01:52:46 +0000 2015,2415,819,pupper,Pomeranian,0.800538
681579835668455424,2015-12-28 20:57:50 +0000,Twitter for iPhone,This is Apollo. He thought you weren't coming back so he had a mental breakdown. 8/10 we've all been there https://t.co/ojUBrDCHLT,,8,Apollo,Mon Dec 28 20:57:50 +0000 2015,3247,1177,,Rottweiler,0.760671
681523177663676416,2015-12-28 17:12:42 +0000,Twitter for iPhone,This is Carly. She's actually 2 dogs fused together. Very innovative. Probably has superpowers. 12/10 for double dog https://t.co/GQn2IopLud,,12,Carly,Mon Dec 28 17:12:42 +0000 2015,13157,5197,,Norfolk terrier,0.205067
681320187870711809,2015-12-28 03:46:05 +0000,Twitter for iPhone,This is Glacier. He's a very happy pup. Loves to sing in the sunlight. 11/10 https://t.co/jTBPqKgkz7,,11,Glacier,Mon Dec 28 03:46:05 +0000 2015,2404,671,,Samoyed,0.362596
681297372102656000,2015-12-28 02:15:26 +0000,Twitter for iPhone,"This is actually a lion. We only rate dogs. For the last time please only send dogs. Thank u.
12/10 would still pet https://t.co/Pp26dMQxap",,12,actually,Mon Dec 28 02:15:26 +0000 2015,2956,854,,Lhasa,0.482401
681281657291280384,2015-12-28 01:12:59 +0000,Twitter for iPhone,Meet Sarge. His parents signed him up for dancing lessons but his true passion is roller coasters 11/10 very petable https://t.co/KvVoBIgkje,,11,Sarge,Mon Dec 28 01:12:59 +0000 2015,2961,994,,Saint Bernard,0.99883
681261549936340994,2015-12-27 23:53:05 +0000,Twitter for iPhone,Say hello to Panda. He's a Quackadilly Shooster. Not amused by your fake ball throwing motion. 9/10 would hug lots https://t.co/wL1iDvbcVk,,9,Panda,Sun Dec 27 23:53:05 +0000 2015,1333,236,,Tibetan terrier,0.382101
681193455364796417,2015-12-27 19:22:30 +0000,Twitter for iPhone,This is Aspen. He's astronomically fluffy. I wouldn't stop petting this dog if the world was ending around me 11/10 https://t.co/oBlgL9nxpx,,11,Aspen,Sun Dec 27 19:22:30 +0000 2015,3411,1334,,Pomeranian,0.992619
680940246314430465,2015-12-27 02:36:20 +0000,Twitter for iPhone,This is Alice. She's an idiot. 4/10 https://t.co/VQXdwJfkyS,,4,Alice,Sun Dec 27 02:36:20 +0000 2015,2922,935,,soft-coated wheaten terrier,0.289598
680934982542561280,2015-12-27 02:15:25 +0000,Twitter for iPhone,Say hello to Sadie. She's a Tortellini Sidewinder. Very jubilant pup. Seems loyal. Leaves on point. 10/10 petable af https://t.co/g2bTu4ayPl,,10,Sadie,Sun Dec 27 02:15:25 +0000 2015,1912,393,,Labrador retriever,0.7843979999999999
680913438424612864,2015-12-27 00:49:49 +0000,Twitter for iPhone,Meet Griswold. He's dapper as hell. Already pumped for next Christmas. 11/10 https://t.co/5NrpNDyFzN,,11,Griswold,Sun Dec 27 00:49:49 +0000 2015,2210,562,,Pomeranian,0.615678
680889648562991104,2015-12-26 23:15:17 +0000,Twitter for iPhone,This is Cheesy. It's her birthday. She's patiently waiting to eat her party muffin. 9/10 happy birthday pup https://t.co/cH2H7mch2H,,9,Cheesy,Sat Dec 26 23:15:17 +0000 2015,1611,324,,Shetland sheepdog,0.876337
680836378243002368,2015-12-26 19:43:36 +0000,Twitter for iPhone,This is Ellie. She's secretly ferocious. 12/10 very deadly pupper https://t.co/BF4BW8LUgb,,12,Ellie,Sat Dec 26 19:43:36 +0000 2015,3183,1183,pupper,Pembroke,0.427781
680609293079592961,2015-12-26 04:41:15 +0000,Twitter for iPhone,This is Brody. That is his chair. He loves his chair. Never leaves it. 9/10 might be stuck actually https://t.co/WvJRg0XJit,,9,Brody,Sat Dec 26 04:41:15 +0000 2015,2410,624,,French bulldog,0.700764
680473011644985345,2015-12-25 19:39:43 +0000,Twitter for iPhone,"This is Hector. He thinks he's a hammer. Silly Hector. You're a pupper, not a hammer. 10/10 https://t.co/OdUFuZIXiI",,10,Hector,Fri Dec 25 19:39:43 +0000 2015,2344,671,pupper,Lakeland terrier,0.796694
680161097740095489,2015-12-24 23:00:17 +0000,Twitter for iPhone,Meet Goliath. He's an example of irony. Head is phenomenally round. Wants to be an ornament. 12/10 would hug gently https://t.co/72Dil0Aktw,,12,Goliath,Thu Dec 24 23:00:17 +0000 2015,2136,669,,bluetick,0.268681
680145970311643136,2015-12-24 22:00:10 +0000,Twitter for iPhone,Say hello to Kawhi. He was doing fine until his hat fell off. He got it back though. 10/10 deep breaths pupper https://t.co/N5pM6WBx7e,,10,Kawhi,Thu Dec 24 22:00:10 +0000 2015,3312,1557,pupper,miniature poodle,0.457117
680130881361686529,2015-12-24 21:00:12 +0000,Twitter for iPhone,This is Reggie. His Santa hat is a little big. 10/10 he's still having fun https://t.co/w0dcGXq7qK,,10,Reggie,Thu Dec 24 21:00:12 +0000 2015,2111,855,,Maltese dog,0.199121
680115823365742593,2015-12-24 20:00:22 +0000,Twitter for iPhone,This is Ozzy. He woke up 2 minutes before he had to be ready for the Christmas party. 9/10 classic Ozzy https://t.co/Kt9vmw0Fap,,9,Ozzy,Thu Dec 24 20:00:22 +0000 2015,2496,823,,pug,0.999365
679844490799091713,2015-12-24 02:02:12 +0000,Twitter for iPhone,This is Willie. He's floating away and needs your assistance. Please someone help Willie. 10/10 https://t.co/MJqygWqt8X,,10,Willie,Thu Dec 24 02:02:12 +0000 2015,2185,687,,Airedale,0.903832
679777920601223168,2015-12-23 21:37:40 +0000,Twitter for iPhone,This is Rinna. She's melting. 10/10 get inside pupper https://t.co/PA0czwucsb,,10,Rinna,Wed Dec 23 21:37:40 +0000 2015,2857,995,pupper,bloodhound,0.5288189999999999
679722016581222400,2015-12-23 17:55:32 +0000,Twitter for iPhone,This is Mike. He is a Jordanian Frito Pilates. Frowning because he can't see directly in front of him. 8/10 https://t.co/NL5QJwdEpF,,8,Mike,Wed Dec 23 17:55:32 +0000 2015,1536,425,,boxer,0.459604
679475951516934144,2015-12-23 01:37:45 +0000,Twitter for iPhone,This is Evy. She doesn't want to be a Koala. 9/10 https://t.co/VITeF0Kl9L,,9,Evy,Wed Dec 23 01:37:45 +0000 2015,1920,580,,Maltese dog,0.145742
679462823135686656,2015-12-23 00:45:35 +0000,Twitter for iPhone,Meet Hurley. He's the curly one. He hugs every other dog he sees during his walk. 11/10 for spreading the love https://t.co/M6vqkt2GKV,,11,Hurley,Wed Dec 23 00:45:35 +0000 2015,29349,16965,,toy poodle,0.62178
679132435750195208,2015-12-22 02:52:45 +0000,Twitter for iPhone,This is Louis. He's a river dancer. His friends think it's badass. All are very supportive. 10/10 for Louis https://t.co/qoIvjKMY58,,10,Louis,Tue Dec 22 02:52:45 +0000 2015,2699,1035,,Scottish deerhound,0.19461
679111216690831360,2015-12-22 01:28:25 +0000,Twitter for iPhone,This is officially the greatest yawn of all time. 12/10 https://t.co/4R0Cc0sLVE,,12,officially,Tue Dec 22 01:28:25 +0000 2015,5420,2308,,kelpie,0.189423
678969228704284672,2015-12-21 16:04:13 +0000,Twitter for iPhone,Meet Lola. She's a Metamorphic Chartreuse. Plays with her food. Insubordinate and churlish. Exquisite hardwood 11/10 https://t.co/etpBNXwN7f,,11,Lola,Mon Dec 21 16:04:13 +0000 2015,1499,409,,Labrador retriever,0.680251
678798276842360832,2015-12-21 04:44:55 +0000,Twitter for iPhone,This is Linda. She fucking hates trees. 7/10 https://t.co/blaY85FIxR,,7,Linda,Mon Dec 21 04:44:55 +0000 2015,3160,1028,,Airedale,0.583122
678774928607469569,2015-12-21 03:12:08 +0000,Twitter for iPhone,This is Tug. He's not required to wear the cone he just wants his voice to project more clearly. 11/10 https://t.co/Sp739Ou2qx,,11,Tug,Mon Dec 21 03:12:08 +0000 2015,2571,820,,Pembroke,0.194681
678764513869611008,2015-12-21 02:30:45 +0000,Twitter for iPhone,"Meet Wilson. He got caught humping the futon. He's like ""dude, help me out here"" 10/10 I'd help Wilson out https://t.co/m6XoclB0qv",,10,Wilson,Mon Dec 21 02:30:45 +0000 2015,1480,413,,Irish terrier,0.696646
678755239630127104,2015-12-21 01:53:54 +0000,Twitter for iPhone,This is Dash. He didn't think the water would be that cold. Damn it Dash it's December. Think a little. 10/10 https://t.co/NqcOwG8pxW,,10,Dash,Mon Dec 21 01:53:54 +0000 2015,6475,2922,,malamute,0.606654
678424312106393600,2015-12-20 03:58:55 +0000,Twitter for iPhone,This is Crystal. She's a shitty fireman. No sense of urgency. People could be dying Crystal. 2/10 just irresponsible https://t.co/rtMtjSl9pz,,2,Crystal,Sun Dec 20 03:58:55 +0000 2015,4992,2270,,Maltese dog,0.759945
678410210315247616,2015-12-20 03:02:53 +0000,Twitter for iPhone,Say hello to Jerome. He can shoot french fries out of his mouth at insane speeds. Deadly af. 10/10 https://t.co/dIy88HwrX8,,10,Jerome,Sun Dec 20 03:02:53 +0000 2015,3825,1609,,schipperke,0.145877
678389028614488064,2015-12-20 01:38:42 +0000,Twitter for iPhone,"This is Bella. She just learned that her final grade in chem was a 92.49 
poor pupper 11/10 https://t.co/auOoKuoveM",,11,Bella,Sun Dec 20 01:38:42 +0000 2015,1711,381,pupper,miniature pinscher,0.516284
678334497360859136,2015-12-19 22:02:01 +0000,Twitter for iPhone,This is Rosie. She has a snazzy bow tie and a fin for a tail. Probably super fast underwater. Cool socks 10/10 https://t.co/GO76MdGBs0,,10,Rosie,Sat Dec 19 22:02:01 +0000 2015,1182,223,,Norfolk terrier,0.378643
678255464182861824,2015-12-19 16:47:58 +0000,Twitter for iPhone,This is Jessifer. She is a Bismoth Teriyaki. Flowers being attacked by hurricanes on bandana (rad). 9/10 stellar pup https://t.co/nZhmRwZzWv,,9,Jessifer,Sat Dec 19 16:47:58 +0000 2015,1447,328,,Chihuahua,0.613819
678021115718029313,2015-12-19 01:16:45 +0000,Twitter for iPhone,This is Reese. He likes holding hands. 12/10 https://t.co/cbLroGCbmh,,12,Reese,Sat Dec 19 01:16:45 +0000 2015,12354,5615,,miniature pinscher,0.822048
677698403548192770,2015-12-18 03:54:25 +0000,Twitter for iPhone,This is Sadie. She got her holidays confused. 9/10 damn it Sadie https://t.co/fm7HxOsuPK,,9,Sadie,Fri Dec 18 03:54:25 +0000 2015,1118,287,,Shih-Tzu,0.916645
677530072887205888,2015-12-17 16:45:31 +0000,Twitter for iPhone,Say hello to Axel. He's a Black Chevy Pinot on wheels. 0 to 60 in 5.7 seconds (if downhill). 9/10 I call shotgun https://t.co/DKe9DBnnHE,,9,Axel,Thu Dec 17 16:45:31 +0000 2015,966,204,,Staffordshire bullterrier,0.6892590000000001
677331501395156992,2015-12-17 03:36:28 +0000,Twitter for iPhone,Meet Humphrey. He's a Northern Polyp Viagra. One ear works. Face stuck like that. Always surprised. 9/10 petable af https://t.co/FS7eJQM2F4,,9,Humphrey,Thu Dec 17 03:36:28 +0000 2015,986,208,,beagle,0.313464
677314812125323265,2015-12-17 02:30:09 +0000,Twitter for iPhone,"Meet Tassy &amp; Bee. Tassy is pretty chill, but Bee is convinced the Ruffles are haunted. 10/10 &amp; 11/10 respectively https://t.co/fgORpmTN9C",,10,Tassy,Thu Dec 17 02:30:09 +0000 2015,1497,471,,Blenheim spaniel,0.924127
677301033169788928,2015-12-17 01:35:24 +0000,Twitter for iPhone,This is Juckson. He's totally on his way to a nascar race. 5/10 for Juckson https://t.co/IoLRvF0Kak,,5,Juckson,Thu Dec 17 01:35:24 +0000 2015,1112,354,,Japanese spaniel,0.6611779999999999
676975532580409345,2015-12-16 04:01:59 +0000,Twitter for iPhone,This is Cooper. He doesn't know how cheese works. Likes the way it feels on his face. Cheeky tongue slip. 11/10 https://t.co/j1zczS0lI5,,11,Cooper,Wed Dec 16 04:01:59 +0000 2015,2527,949,,malamute,0.363257
676949632774234114,2015-12-16 02:19:04 +0000,Twitter for iPhone,This is Tyrus. He's a Speckled Centennial Ticonderoga. Terrified of floating red ball. Nifty bandana. 8/10 v petable https://t.co/HqM3YhCaaa,,8,Tyrus,Wed Dec 16 02:19:04 +0000 2015,1185,348,,Welsh springer spaniel,0.206479
676811746707918848,2015-12-15 17:11:09 +0000,Twitter for iPhone,Say hello to Penny &amp; Gizmo. They are practicing their caroling. The ambition in the room is tangible. 9/10 for both https://t.co/aqBHjjh5VD,,9,Penny,Tue Dec 15 17:11:09 +0000 2015,1304,379,,Chihuahua,0.440916
